{
  "model_id": "deepseek-r1-14b",
  "display_name": "DeepSeek-R1 14B (Reasoning)",
  "provider": "ollama",
  "model_path": "deepseek-r1:14b",
  "capabilities": ["reasoning", "synthesis", "validation"],
  "quality_level": "balanced",
  "vram_mb": 9000,
  "ram_mb": 3000,
  "context_window": 8192,
  "quantization": "Q4_K_M",
  "parameters": {
    "temperature": 0.7,
    "top_p": 0.9,
    "top_k": 40,
    "repeat_penalty": 1.1,
    "num_gpu_layers": -1,
    "n_ctx": 8192,
    "n_batch": 512
  },
  "enabled": true,
  "metadata": {
    "architecture": "qwen",
    "base_model": "DeepSeek-R1-Distill-Qwen-14B",
    "license": "MIT",
    "created_at": "2026-01-08T17:00:00Z"
  }
}
